{
  "schema": "crowsi://control/certificate-manager-handoff-evidence/v2",
  "receipt_id": "manager.handoff.sample",
  "nonce_base64": "AwMDAwMDAwMDAwMDAwMDAwMDAwMDAwMDAwMDAwMDAwM",
  "issuer": "service://crowsi/certificate-manager",
  "audience": "service://crowsi/policy-administrator",
  "disposition": "accepted",
  "action": "issue",
  "authorization_jti": "authorization.jti.sample",
  "operation_id": "operation.certificate.sample",
  "lease_digest_sha256": "1010101010101010101010101010101010101010101010101010101010101010",
  "authorization_command_digest_sha256": "2020202020202020202020202020202020202020202020202020202020202020",
  "security_domain": "security.crowsi",
  "deployment_id": "deployment.local",
  "trust_revision": 7,
  "target_resource_id": "resource.certificate.sample",
  "expected_resource_version": 0,
  "previous_fence": 0,
  "current_fence": 1,
  "previous_lifecycle_revocation_epoch": 0,
  "lifecycle_revocation_epoch": 0,
  "manager_workload": "spiffe://crowsi.test/certificate-manager",
  "receipt_key_id": "manager.handoff.key",
  "receipt_key_version": "version.0001",
  "receipt_public_key_spki_sha256": "6060606060606060606060606060606060606060606060606060606060606060",
  "receipt_signature_algorithm": "ecdsa-p256-sha256-p1363-low-s",
  "receipt_key_purpose": "certificate-manager-handoff-receipt",
  "observed_at_epoch_s": 10005,
  "expires_at_epoch_s": 10035,
  "signed": {
    "key_id": "manager.handoff.key",
    "key_version": "version.0001",
    "public_key_spki_sha256": "6060606060606060606060606060606060606060606060606060606060606060",
    "key_purpose": "certificate-manager-handoff-receipt",
    "algorithm": "ecdsa-p256-sha256-p1363-low-s",
    "digest_sha256": "65e894ccd334b26365d52ca91d607096e9518394b260cd0d0b28053549b03f46",
    "signature_base64": "AAAAAAAAAAAAAAAAAAAAAAAAAAAAAAAAAAAAAAAAAAAAAAAAAAAAAAAAAAAAAAAAAAAAAAAAAAAAAAAAAAAAAA=="
  }
}
